{
  "schema_version": "d0-v1",
  "request_id": "APR-fixture0001",
  "case_id": "CASE-fixture0001",
  "action_id": "ACTION-fixture0001",
  "decision": "APPROVED",
  "authenticated_subject": "local_analyst_fixture",
  "authentication_method": "local_os_account",
  "decided_at": "2026-10-23T10:01:00Z",
  "expires_at": "2026-10-23T10:05:00Z",
  "case_revision": 1,
  "action_digest_sha256": "aaaaaaaaaaaaaaaaaaaaaaaaaaaaaaaaaaaaaaaaaaaaaaaaaaaaaaaaaaaaaaaa"
}
